id,title,text,author
0,Le nere scale della mia taverna,"Le nere scale della mia taverna
tu discendi tutto intriso di vento.
I bei capelli caduti tu hai
sugli occhi vivi in un mio firmamento
remoto.
Nella fumosa taverna
ora è l’odore del porto e del vento.
Libero vento che modella i corpi
e muove il passo ai bianchi marinai.",Sandro Penna
1,"Era l’alba su i colli, e gli animali","Era l’alba su i colli, e gli animali
ridavano alla terra i calmi occhi.
Io tornavo alla casa di mia madre.
Il treno dondolava i miei sbadigli
acerbi. E il primo vento era si l’erbe.
Altissimo e confuso, il paradiso
della mia vita non aveva ancora
volto. Ma l’ospite alla terra, nuovo,
già chiedeva l’amore, inginocchiato.
Cadeva la preghiera nella chiusa
casa entro odori di libri di scuola.
Navigavano al vespero felici
gridi di uccelli nel mio cielo d’ansia.",Sandro Penna
2,Quando tornai al mare di una volta,"Quando tornai al mare di una volta,
nella sera fra i caldi viali
ricercavo i compagni di allora…
Come un lupo impazzito odoravo
la calda ombra fra le case. L’odore
antico e vuoto mi cacciava all’ampia
spiaggia sul mare aperto. Lì trovavo
l’amarezza più chiara e la mia ombra
lunare ferma su l’antico odore.",Sandro Penna
3,Ero solo e seduto. La mia storia ,"Ero solo e seduto. La mia storia
appoggiavo a una chiesa senza nome.
Qualche figura entrò senza rumore,
senz’ombra sotto il cielo del meriggio.
Nude campane che la vostra storia
non raccontate mai con precisione.
In me si fabbricò tutto il meriggio
intorno ad una storia senza nome.",Sandro Penna
4,Felice chi è diverso,"Felice chi è diverso
essendo egli diverso.
Ma guai a chi è diverso
essendo egli comune.",Sandro Penna
5,Mattino,"Dalla finestra aperta
Entran le voci calme
Del fiume,
I canti lontani
Delle lavandaie
Laggiù fra i pioppi e gli ontani,
Presso la pura corrente
Che mormora sì dolcemente
Il fumo dei vapori
Si confonde con quello delle case
Sotto il riso trionfale
Del cielo.
Sull’altra riva, nel viale
Gli affiches azzurri
Delle compagnie di navigazione
Riempiono di nostalgia e d’illusione
Il cuore degli uomini
Seduti sulle panchine.
Penso a una fanciulla bionda.
Fra poco sarà mezzogiorno
E una gran tenerezza m’invade,
E una voglia di piangere senza perché.",Attilio Bertolucci
6,Ginestre,"Gioventù sacrificata
delle ginestre
grama e splendente
per le pendici d’Appennino.
Vento e luce
ti nutrono.
Solitudine t’adorna.",Attilio Bertolucci
7,Commedia della sera,"Passano carri di fieno
davanti a ville addormentate,
arlecchini dormono
all’ombra di lucenti magnolie.
Fra breve il tramonto
coprirà di porpora le nuvole,
serena la sera scenderà
battendo gli zoccoli sulla strada.
I cavalli lentamente
masticano un po’ d’erba fresca.",Attilio Bertolucci
8,At home,"Il sole lentamente si sposta
sulla nostra vita, sulla paziente
storia dei giorni che un mite
calore accende, d’affetti e di memorie.
A quest’ora meridiana
lo spaniel invecchia sul mattone
tiepido, il tuo cappello di paglia
s’allontana nell’ombra della casa.",Attilio Bertolucci
9,Uccelli di passo,"Le belle giornate se ne vanno rapide,
viene l’autunno.
Ma di questa dolcezza che riempie
l’aria del mezzogiorno ventilata
sull’ultimo sudore del volto,
di questo riposo dell’anno
ti ricorderai
e del sul quieto affanno?
Oh, fuggir via quando nel rosa eterno
della sera imminente
s’allontanano uccelli di passo
e portano sulle ali cangianti
l’estrema luce del giorno,
oh, fuggire ai paesi distanti
dove quiete finestre si chiudono
sui relitti del cielo.",Attilio Bertolucci
10,Vermiglia era,"Vermiglia era la sera e io Lasciatemi
dormire Che io continui a dormire procedevo
verso il collinoso cumulo di dimore
avvicinandomi al vermiglio volto della sera
che una sciarpa fuggente Oh fa’
che io dorma avanzavo
per una salita dolce quasi impercettibile
luce del giorno e rosso della sera
su me che camminavo impegnando
una mortale contesa e io
impotente seguivo
la direzione della sera
chiedendo pietà e ancora sonno a questi lari benigni.",Attilio Bertolucci
11,Ritornare qui,"Ritornare qui è come risuscitare
e sentirsi chiedere per quanto tempo
oh non molto l’inverno arriva presto
e siamo attrezzati tutt’al più per l’autunno.
A questo sole che esalta i colori dei fiori
e inebbria le farfalle in voli di sbieco
verso la profondità degli abissi domestici
dove la plastica ammaccata stinge il suo azzurro sul verde
il bambino ingessato per quaranta giorni abbronza
tardivamente i pomelli montanari sta
imparando la pazienza delle malattie auguri
e auguri ancora per gli anni che verranno.
L’inganno utile dell’ora legale
non impedisce che le giornate si accorcino
e che il vento suoni con flabelli di foglie
condannate in maniera visibile e tragica
dalla luce nemica del cielo rasserenato.",Attilio Bertolucci
12,Mattino d’autunno,"Un pallido sole che scotta
Come se avesse la febbre
E fa sternutire quando
La gioia d’esser giovani
E di passeggiare di mattina
Per i viali quasi deserti
E’ al colmo, illumina l’erba
Bagnata e la facciata rosa
Di un palazzo. Tutto è gioviale
Buongiorno e sereno, raffreddore
E mezzastagione. E Goethe
In mezzo alla piazza sorride.",Attilio Bertolucci
13,Milano,"a Vittorio Sereni
Tutto il giorno la pioggia grigia e brevi
schiarite, tutto il giorno questa attesa
nella cara città del Nord di tante
sconosciute esistenze come foglie
intorno a me stormenti.
Lontano, sotto un cielo più chiaro,
la campagna già estiva s’addormenta
al nascosto cucù.
Ma già voci familiari aprono la sera
rossa di nubi, indugiano le ore
in una quieta voglia di speranza.
Tenero inferno, addio, ecco già fugge
l’incanto dei tuoi lastrici anneriti
che il sole obliquo indorerà tramontando
nell’unanime moto della folla.",Attilio Bertolucci
14,Siamo tutti politici (e animali),"Siamo tutti politici (e animali):
premesso questo, posso dirti che
odio i politici odiosi: (e ti risparmio anche soltanto un parco abbozzo di catalogo
esemplificativo e ragionato): (puoi sceglierti da te cognomi e nomi, e sparare
nel mucchio): (e sceglierti i perché, caso per caso)
ma, per semplificare, ti aggiungo che, se è vero che,
per me (come dico e ridico) è politica tutto,
a questo mondo, non è poi tutto, invece, la politica: (e questo mi definisce,
sempre per me, i politici odiosi, e il mio perché:
amo, così, quella grande politica
che è viva nei gesti della vita quotidiana, nelle parole quotidiane
(come ciao, pane, fica, grazie mille): (come quelle che ti trovi graffite dentro i cessi,
spraiate sopra i muri, tra uno slogan e un altro, abbasso, viva):
(e poi, lo so che non si dice, ma, alla fine, mi sono odiosi e uomini e animali)",Edoardo Sanguineti
15,Occhiali,"Mi sono riadattato agli occhiali (che la patente, a me, rende obbligati, ormai,
in un paio solo di giorni: vedo tutto più netto: (ma niente mi è, per questo,
diventato migliore, in verità: un semaforo è sempre un semaforo, un marciapiede
è un marciapiede: e io sono sempre io, così)
(quanto al doloroso senso di capogiro,
vaticinato, con l’emicrania, da un Istituto Ottico di corso Buenos Aires, al quale
mi sono rivolto, questa volta, l’ho sperimentato e l’ho superato): (l’oculista
affermava che, con il tempo, io mi ero costruito una mia rappresentazione arbitraria
della realtà, adesso destinata, con le lenti, a sfasciarsi di colpo):
e ho potuto
sperare, per un attimo, di potermi rifare, a poco prezzo, una vita e una vista)",Edoardo Sanguineti
16,"Se d’amore si muore, siamo morti noi","se d’amore si muore, siamo morti noi:
siamo un romanzo d’appendice in atto: (anzi,
siamo un romanzo nazional-popolare, ma calibraticamente camuffato da romanzetto rosa): (anzi,
siamo un romanzo osè): (un rosè): (anzi, una coppia di vegeti, di vegetanti vecchietti,
torchiati nel torpido torchio delle nozze d’argento): (a un passo, a un pelo, appena,
da un romanzo nero): (siamo un romanzo rosso, quasi): e noi facciamo, parliamoci chiaro,
pena piena, e pietà
comunico le coordinate necessarie; torno da Como, è il 26
settembre, sono le 21,37, ho chiesto il conto al ristorante, prenderò il rapido
delle 21,50, e ti ho capito: è tutto:
perché, per te, per me, non è possibile
sopportarla più oltre, questa ambivalenza insolubile, nel vino della vita che viviamo:
questa vita, anzi: (la vita): (annacquata, innacquata): e se ti dico e se ti scrivo che
non sono altro che un contemporaneo, a capirmi, a capirci, se va bene, abbiamo, in tutto
e per tutto, il 25% dei nostri eredi naturali, allo stato attuale delle cose:
così, con tanti auguri, ti aggiungo, poi, che noi
se d’amore si vive, siamo vivi.",Edoardo Sanguineti
17,Ballata delle donne,"Quando ci penso, che il tempo è passato,
le vecchie madri che ci hanno portato,
poi le ragazze, che furono amore,
e poi le mogli e le figlie e le nuore,
femmina penso, se penso una gioia:
pensarci il maschio, ci penso la noia.
Quando ci penso, che il tempo è venuto,
la partigiana che qui ha combattuto,
quella colpita, ferita una volta,
e quella morta, che abbiamo sepolta,
femmina penso, se penso la pace:
pensarci il maschio, pensare non piace.
Quando ci penso, che il tempo ritorna,
che arriva il giorno che il giorno raggiorna,
penso che è culla una pancia di donna,
e casa è pancia che tiene una gonna,
e pancia è cassa, che viene al finire,
che arriva il giorno che si va a dormire.
Perché la donna non è cielo, è terra
carne di terra che non vuole guerra:
è questa terra, che io fui seminato,
vita ho vissuto che dentro ho piantato,
qui cerco il caldo che il cuore ci sente,
la lunga notte che divento niente.
Femmina penso, se penso l’umano
la mia compagna, ti prendo per mano.",Edoardo Sanguineti
18,Afferra questo mercurio,"afferra questo mercurio, questa fredda gengiva, questo miele,
questa sfera di vetro arido;
misura attentamente la testa del nostro bambino
e non torcere adesso il suo piede impercettibile:
nel tuo capezzolo devi ormai convertire
un prolungato continente di lampade,
il fiato ossessivo dei giardini
critici, le pigre balene del ventre, le ortiche
e il vino, e la nausea e la ruggine;
perché ogni strada subito
vorrà corrergli incontro, un’ernia ombelicale incidere
il suo profilo di fumo, qualche ippopotamo donargli
i suoi denti di forfora e di fosforo nero:
evita il vento,
i luoghi affollati, i giocolieri, gli insetti;
e a sei mesi egli potrà raddoppiare il suo peso, vedere l’oca,
stringere la vestaglia, assistere alla caduta dei gravi;
strappalo dunque alla sua vita di alghe e di globuli, di piccoli nodi,
di indecisi lobi:
il suo gemito conquisterà le tue liquide ferite
e i suoi occhi di obliquo burro correggeranno questi secoli senza nome!",Edoardo Sanguineti
19,Quadernetto,"Un anno... Tratteneva la sua stella
il cielo dell’Avvento. Sulla bocca
senza febbre o paura la mia mano
ti disegnava, oscura, una parola.
E la sfera dell’anima e dell’anno
vibrava in cima a uno zampillo d’oro
alto e sottile il sangue.
                                          Ne tremavamo
sorridenti agli sguardi – all’accostarsi
buio di quel guardiano incorruttibile
che nei giardini chiude le fontane.
Capodanno ’53-’54",Cristina Campo
20,Sindbad,"L’aria di giorno in giorno si addensa intorno a te
di giorno in giorno consuma le mie palpebre.
L’universo s’è coperto il viso
ombre mi dicono: è inverno.
Tu nel vergine spazio dove si cullano
isole negligenti, io nel terrore
dei lillà, in una vampa di tortore,
sulla mite, domestica strada della follia.
Si stivano canapa, olive
mercati e anni... Io non chino le ciglia.
Mezzanotte verrà, il primo grido
del silenzio, il lunghissimo ricadere
del fagiano tra le sue ali.",Cristina Campo
21,Estate indiana,"Ottobre, fiore del mio pericolo –
primavera capovolta nei fiumi.
Un’ora m’è indifferente fino alla morte
– l’acero ha il volo rotto, i fuochi annebbiano –
un’ora il terrore di esistere mi affronta
raggiante, come l’astero rosso.
Tutto è già noto, la marea prevista,
pure tutto si ottenebra e rischiara
con fresca disperazione, con stupenda
fermezza...
                     La luce tra due piogge, sulla punta
di fiume che mi trafigge tra corpo
e anima, è una luce di notte
– la notte che non vedrò –
chiara nelle selve.",Cristina Campo
22,Elegia di Portland Road,"Cosa proibita, scura la primavera.
Per anni camminai lungo primavere
più scure del mio sangue. Ora tornano sul Tamigi
sul Tevere i bambini trafitti dai lunghi gigli
le piccole madri nei loro covi d’acacia
l’ora eterna sulle eterne metropoli
che già si staccano, tremano come navi
pronte all’addio...
                                  Cosa proibita
scura la primavera.
Io vado sotto le nubi, tra ciliegi
così leggeri che già sono quasi assenti.
Che cosa non è quasi assente tranne me,
da così poco morta, fiamma libera?
(E al centro del roveto riavvampano i vivi
nel riso, nello splendore, come tu li ricordi
come tu ancora li implori)",Cristina Campo
23,Le mani,"Queste tue mani a difesa di te:
mi fanno sera sul viso.
Quando lente le schiudi, là davanti
la città è quell'arco di fuoco.
Sul sonno futuro
saranno persiane rigate di sole
e avrò perso per sempre
quel sapore di terra e di vento
quando le riprenderai.",Vittorio Sereni
24,In me il tuo ricordo,"In me il tuo ricordo è un fruscìo
solo di velocipedi che vanno
quietamente là dove l'altezza
del meriggio discende
al più fiammante vespero
tra cancelli e case
e sospirosi declivi
di finestre riaperte sull'estate.
Solo, di me, distante
dura un lamento di treni,
d'anime che se ne vanno.
E là leggera te ne vai sul vento,
ti perdi nella sera.",Vittorio Sereni
25,Dimitrios,"Alla tenda s'accosta
il piccolo nemico
Dimitrios e mi sorprende,
d'uccello tenue strido
sul vetro del meriggio.
Non torce la bocca pura
la grazia che chiede pane,
non si vela di pianto
lo sguardo che fame e paura
stempera nel cielo d'infanzia.
È già lontano,
arguto mulinello
che s'annulla nell'afa,
Dimitrios, su lande avare
appena credibile, appena
vivo sussulto
di me, della mia vita
esitante sul mare.",Vittorio Sereni
26,Fissità,"Da me a quell'ombra in bilico tra fiume e mare
solo una striscia di esistenza
in controluce dalla foce.
Quell'uomo.
Rammenda reti, ritinteggia uno scafo.
Cose che io non so fare. Nominarle appena.
Da me a lui nient'altro: una fissità.
Ogni eccedenza andata altrove. O spenta.",Vittorio Sereni
27,Viaggio di andata e ritorno,"Andrò a ritroso della nostra corsa
di poco fa
che tanto bella mai ti sorprese la luna.
Mi resta una città prossima al sonno
di prima primavera.
O fuoco che ora tu sei
dileguante, o ceneri confuse
di campagna che annotta e si sfa,
o strido che sgretola l'aria
e insieme divide il mio cuore.",Vittorio Sereni
28,Ancora sulla strada di Zenna,"Perché quelle piante turbate m'inteneriscono?
Forse perché ridicono che il verde si rinnova
a ogni primavera, ma non rifiorisce la gioia?
Ma non è questa volta un mio lamento
e non è primavera, è un'estate,
l'estate dei miei anni.
Sotto i miei occhi portata dalla corsa
la costa va formandosi immutata
da sempre e non la muta il mio rumore
né, più fondo, quel repentino vento che la turba
e alla prossima svolta, forse finirà.
E io potrò per ciò che muta disperarmi
portare attorno il capo bruciante di dolore.
Ma l'opaca trafila delle cose
che là dietro indovino: la carrucola nel pozzo,
la spola della teleferica nei boschi,
i minimi atti, i poveri
strumenti umani avvinti alla catena
della necessità, la lenza
buttata a vuoto nei secoli,
le scarse vite, che all'occhio di chi torna
e trova che nulla nulla è veramente mutato
si ripetono identiche,
quelle agitate braccia che presto ricadranno,
quelle inutilmente fresche mani
che si tendono a me e il privilegio
del moto mi rinfacciano.
Dunque pietà per le turbate piante
evocate per poco nella spirale del vento
che presto da me arretreranno via via
salutando salutando.
Ed ecco già mutato il mio rumore
s'impunta un attimo e poi si sfrena
fuori da sonni enormi
e un altro paesaggio gira e passa.",Vittorio Sereni
29,Autostrada della Cisa,"Tempo dieci anni, nemmeno
prima che rimuoia in me mio padre
(con malagrazia fu calato giù
e un banco di nebbia ci divise per sempre).
Oggi a un chilometro dal passo
una capelluta scarmigliata erinni
agita un cencio già spento, e addio.
Sappi- disse ieri lasciandomi qualcuno-
sappilo che non finisce qui,
di momento in momento credici a quell’altra vita,
di costa in costa aspettala e verrà
come di là dal valico un ritorno d’estate.
Parla così la recidiva speranza, morde
in un’anguria la polpa dell’estate,
vede laggiù quegli alberi perpetuare
ognuno in sé la sua ninfa
e dietro la raggera degli echi e dei miraggi
nella piana assetata il palpito di un lago
fare di Mantova una Tenochititlàn
Di tunnel in tunnel di abbagliamento in cecità
tendo una mano. Mi ritorna vuota.
Allungo un braccio. Stringo una spalla d’aria.
Ancora non lo sai
-sibila nel frastuono delle volte
la sibilla, quella
che sempre più ha voglia di morire –
non lo sospetti ancora
che di tutti i colori il più forte
il più indelebile
è il colore del vuoto?",Vittorio Sereni
30,In una casa vuota,"Si ravvivassero mai. Sembrano ravvivarsi
di stanza in stanza, non si ravvivano
veramente mai in questa aria di pioggia. Si è
ravvivata - io veggente di colpo nella lenta schiarita -
una ressa là fuori di margherite e ranuncoli.
Purchè si avesse.
Purchè si avesse una storia comunque
- e intanto Monaco di prima mattina sui giornali
ah meno male: c’era stato un accordo -
purchè si avesse una storia squisita tra le svastiche
sotto la pioggia un settembre.
Oggi si è - e si è comunque male,
parte del male tu stesso tornino o no sole e prato coperti.",Vittorio Sereni
31,Domenica dopo la guerra,"Per due che si ritrovano in una
domenica dopo la guerra
allora può
rifiorire il deserto del mare?
...amami - lui dice - di ritorno
amami a tutta forza con forza
di rivalsa per tutti questi anni...
Ma
...nei primi tempi di guerra
quando le domeniche non erano
che blanda disperazione, stordimento
di campane, rimasuglio
di fumo attardatosi al largo
dell’ultimo postale da Amsterdam...
E si divorano con gli occhi, si
cercano si tendono le mani
di nascosto sulla fiandra del tavolo.
...mare per anni solitario
di anni computabili in onde
braccio di mare divenuto attonito
di tempo pietrificato in spazio
di mutismo...
Rifiorire può dunque il deserto del mare?
Ma no che si annusano e studiano
gentili e teneri quasi
- britannico lui lei fiamminga -
e poi si buttano a trattare l'affare
oggi che nemmeno è domenica.",Vittorio Sereni
32,Periferia 1940,"La giovinezza è tutta nella luce
d’una città al tramonto
dove straziato ed esule ogni suono
si spicca nel brusio.
E tu mia vita salvati se puoi
serba te stessa al futuro
passante e quelle parvenze sui ponti
nel baleno dei fari.",Vittorio Sereni
33,Questa sfusa felicita’ che assale,"Questa sfusa felicità che assale
le facce al sole,
i gomiti e le giacche
– quante dolcezze
sparse nel mercato,
come son belli
gli uomini e le donne!
E vado dietro all’uno
e guardo l’altra,
sento il profumo
inseguo la sua traccia,
raggiungo il troppo
ma il troppo non mi abbraccia.",Patrizia Cavalli
34,Adesso che il tempo sembra tutto mio,"Adesso che il tempo sembra tutto mio
e nessuno mi chiama per il pranzo e per la cena,
adesso che posso rimanere a guardare
come si scioglie una nuvola e come si scolora,
come cammina un gatto per il tetto
nel lusso immenso di una esplorazione, adesso
che ogni giorno mi aspetta
la sconfinata lunghezza di una notte
dove non c’è richiamo e non c’è più ragione
di spogliarsi in fretta per riposare dentro
l’accecante dolcezza di un corpo che mi aspetta,
adesso che il mattino non ha mai principio
e silenzioso mi lascia ai miei progetti
a tutte le cadenze della voce, adesso
vorrei improvvisamente la prigione.
Quante tentazioni attraverso
nel percorso tra la camera
e la cucina, tra la cucina
e il cesso. Una macchia
sul muro, un pezzo di carta
caduto in terra, un bicchiere d’acqua,
un guardar dalla finestra,
ciao alla vicina,
una carezza alla gattina.
Così dimentico sempre
l’idea principale, mi perdo
per strada, mi scompongo
giorno per giorno ed è vano
tentare qualsiasi ritorno.
Addosso al viso mi cadono le notti
e anche i giorni mi cadono sul viso.
Io li vedo come si accavallano
formando geografie disordinate:
il loro peso non è sempre uguale,
a volte cadono dall’alto e fanno buche,
altre volte si appoggiano soltanto
lasciando un ricordo un po’ in penombra.
Geometra perito io li misuro
li conto e li divido
in anni e stagioni, in mesi e settimane.
Ma veramente aspetto
in segretezza di distrarmi
nella confusione perdere i calcoli,
uscire di prigione
ricevere la grazia di una nuova faccia.
E’ tutto così semplice,
sì, era così semplice,
è tale l’evidenza
che quasi non ci credo.
A questo serve il corpo:
mi tocchi o non mi tocchi,
mi abbracci o mi allontani.
Il resto è per i pazzi.",Patrizia Cavalli
35,Sempre aperto teatro,"Indietro, in piedi, da lontano,
di passaggio, tassametro in attesa
la guardavo, i capelli guardavo,
e che vedevo? Mio teatro ostinato,
rifiuto del sipario, sempre aperto teatro,
meglio andarsene a spettacolo iniziato.
O amori – veri o falsi
siate amori, muovetevi felici
nel vuoto che vi offro.
Tutto mi appare in bella superficie
e poi scompare. Perché ritorni
la figura io mi sfiguro, offro
i miei pezzi in prestito o in regalo,
bellezza sia visibile, formata,
guardarla da lontano, anche sfocata,
purché ci sia, purché ci sia, anche non mia.",Patrizia Cavalli
36,Poesie per colazione,"Era alla luce terribilmente sabato,
quel sole infimo che annunzia svogliatezze
mentre nella piazza fin dentro le mie finestre
chiuse si muoveva il mercato prolungato.
L’ultima offerta e poi si chiude. Poi la festa
untuosa e il silenzio. Già si smontavano
i banchetti con la ferocia trasandata
della fine. Forse era possibile
una corsa per prendere qualcosa, forse
restava qualche cassetta ancora non riposta.
Ma non mi decidevo a quella corsa.
Quando scendevo ormai era tardi
tra i mucchi di foglie di carciofi
e i pomodori sfatti dove una vecchietta china
correva rapace alla riscossa di mezze mele
di peperoni buoni per tre quarti.
Ma io non cercavo frutta marcia o fresca,
io volevo soltanto la certezza
della settimana che finisce,
dell’occasione persa.",Patrizia Cavalli
37,Io scientificamente mi domando,"Io scientificamente mi domando
come è stato creato il mio cervello,
cosa ci faccio io con questo sbaglio.
Fingo di avere anima e pensieri
per circolare meglio in mezzo agli altri,
qualche volta mi sembra anche di amare
facce e parole di persone, rare;
esser toccata vorrei poter toccare,
ma scopro sempre che ogni mia emozione
dipende da un vicino temporale.",Patrizia Cavalli
38,"Bene, vediamo un po’ come fiorisci","Bene, vediamo un po’ come fiorisci,
come ti apri, di che colore hai i petali,
quanti pistilli hai, che trucchi usi
per spargere il tuo polline e ripeterti,
se hai fioritura languida o violenta,
che portamento prendi, dove inclini,
se nel morire infradici o insecchisci,
avanti su, io guardo, tu fiorisci.",Patrizia Cavalli
39,Un gatto che dorme il pomeriggio,"Un gatto che dorme il pomeriggio
nel larghissimo letto padronale
in un punto qualunque, però comodo,
che si sveglia in un’ora qualunque,
perchè qualcuno passa e lo carezza,
non si sveglia del tutto nè si chiede
chi è che lo carezza, ma si sporge
dal sonno solo un pò
per stirarsi in arrendevole lunghezza
perchè duri di più quella carezza.
Forse così potrebbe essere l’amore.",Patrizia Cavalli
40,Caino,"Guardami –
Io
con dita di ingegno e brace
ho appeso al sangue le popolazioni in navate di gelo
ho spinto rotto e sepolto
gli inermi della terra
ho vinto tante di quelle volte
facilmente ho battuto
ho stretto ho colpito forte ho atterrito ho acceso con ira improvvisa
tinto d’un fosco
la primavera di tutti
nel precipizio di un furore senz’argine impossibile da barricare
ho tinto l’istante d’un sanguigno somigliante al mio
quando gonfiava vicino a me, in me uno strano scuro animale
in spinte
dalle profondità
un getto in risalita furibonda
da un ignoto di me
da un buio di me
da oscure regioni dal fondo di me da un dentro del dentro di me - sua massa d’ombra gonfiava d’una marea potente
fino al trabocco dal petto
in una peste
in uno sbattere contro altra carne e mutilarla e penarla
in un silenzio
dove l’ultimo gemito si raggruma in freddo fratello
e apre un tacere che non smetterà.
Non smetterà di morire
questa vita
che passa da una carne a quell’altra non smetterà questa bestia
la sua risalita dal petto.
Nasce ora, in questa notte un altro più simile a me. Nasce continuamente.
E io questa notte
in quest’ora
per lui e per me. Ho pietà.",Mariangela Gualtieri
