id,title,text,author
41,Preghiera dell’Alato,"Tu che ti nascondi dentro tutti i nomi.
Se tu fossi.
Se tu fossi una madre. Lui non scantonerebbe cercandoti. Rovistando dentro particelle
atomi e formule non si sbatterebbe
su tavolacci a tagliare il cadavere più solo
lui non calpesterebbe le belle forme del mondo se tu apparissi. Se tu consolassi
come la cagna in leccate il suo nato dolorante.
Se tu. Se tu partorissi. Se tu
con un latte semplice e una tazza
appari. Se tu. Per la sua voglia
d’essere immenso e senza morte se tu
per questo suo pestare
e fare male. Se tu appari
lui non dà da mangiare veleno
non raschia fino all’erosione
non inficca la mano nella costellazione
e l’atomo spaccato lo ricompone
se vuoi. Se glielo chiedi se appari. Se guidi in chiarità. Se tieni. Se ripari. Se stringi
al petto. Se vieni a lui.
“Contano infiniti cadaveri. Sono l’ultima specie umana”. Sporgenti su una rovina che plana a colpi d’ala nera, a becco, a unghiate.
Le ore sono alla fine. La terra respira poco. Fa fatica.
Sale un’indifferenza di ferite un dondolare senza meta. Se tu che cavalchi gli abissi, tu
che puoi ciò che ti piace
appari ora
e piloti la terra in fiorite
loro pietrificate menti
loro indurite porte eccole aperte!
Tu che detti architetture sontuose
agli insetti e insegni ai becchi il cerchio dei nidi e tane assai ingegnose e manovre
di piume e colori perché il seme si attacchi
tu mano nascosta e che nascondi.
Hai sponde troppo alte per i suoi arti manovre misteriose, gittate troppo lunghe.
Adesso guarda. Ascolta la sua voce questo suono suo sillabante
i suoi verbi. Le sue vocali non sono altro che la tua furia respirante
le sue consonanti tu le hai strappate fuori da una gola di bestia mutante.
Vedi non sa. Non sa più niente ora.
E’ qui balbettante. E’ nudo. Incerto.
Ha solo la parola per chiamarti. Vieni.
Vuole perdonarti. Dell’imperfetto con cui lo hai fatto. Vieni. Non avere paura di lui. Ti perdona. Sì ti perdona.",Mariangela Gualtieri
42,Un nome che può essere Salim,"Stacco tutto e me ne vado:
è grosso, una stampella per parte
L’altro non sa scrivere il nome
Somalo? Etiopia. E te pareva,
quante possibilità ciàvevo, su un mijjone
Promiscuità, è questo a definirci
nell’anticamera del reparto dove il sonno ci intuba:
staccati gli aghi ci sveglieremo tutti sani o più malati
a digiuno
e niente acqua dalla mezzanotte
Mettiamo un po’ di musica così ce passa,
s’infila i guanti per Salim, lui non sa scriverlo
ma lei lo ha imparato col tu democratico",Gilda Policastro
43,Precari,"Mamma tu lo sai
che a un idiota qualunque
se va a leggere su un palco
(li chiamano slam poetry)
gli danno quanto meno cento euro
(lo chiamano gettone di presenza)
e se lo vince ci può campare un mese,
certo senza pretese
Mamma mi ricordo quando non camminavi
papà a spingerti giù nel corridoio
overlook dice un poeta di oggi, come in Shining,
e tu battevi i piedi, invece,
come un bambino al mare
Mamma tu lo sai che oggi
se va bene mi rinnovano il contratto
ma devo sorridere, carina e ben vestita
(da ricercatrice a tempo, che hai capito da velina)
Mamma ti ricordi com’eri bella nelle foto
in cui ci somigliamo
(meno disoccupata tu,
meno gettone di presenza
una supplenza tre figli e
– lo leggevi Céline? – l’atroce
farsa del durare)
ma lo sai che adesso
puoi lavorare gratis, se ti dice male,
e un fidanzato a tempo lo rimedi:
precario oggi è come postmoderno ieri,
come il nero,
si mette dappertutto che non stona
Mamma tu nelle foto eri bella,
mentre ora che ci guardano le telecamere
ti prendi, magari, un’ombrellata
e se ne muori
almeno sai chi è stato
Mamma gli altri miei amici hanno le mamme
che sorridono, a volte, tutte vive
(le tue medicine impilate
più il potassio per ripristinare i liquidi),
e adesso, sì, ti porterei dove volevi andare,
in quel posto molto chic a San Lorenzo:
dieci euro e mangi una, due prese,
alla terza ti guardano male (lo chiamano happy hour),
e ti farei leggere quello che scrivo
quando dicevi
la dobbiamo far vedere non è normale,
o ti potrei presentare i fidanzati,
pure quel curdo di cui diresti non sia mai
Mamma ti vengo a prendere, alzati,
dai aria alla stanza e, soprattutto,
fatti trovare
degli ospedali
Scrollo le poesie del poeta operaio
dice rinchiudi un porco nel reparto
noi aspettiamo in fila dopo il girotondo
del rispondi alle domande
(allergie, farmaci, malattie importanti)
poi spostati tu da quella parte
(a fissargli l’ago, senza i guanti)
Siamo in quattro, guardiamo un po’ in aria
un po’ ci sorridiamo mentre Salim non ha capito
che deve togliersi la giacca
Glielo mimo pensando al cianciare brutto
di ogni Facebook sui cosiddetti #migranti
(categoria che vorrebbe smarcarsi)
Siamo fermi in questo spazio che ci contiene
insieme al tempo che a dispetto della musica non passa
Saremo fuori, prima o dopo, saremo a casa
Salim forse resta, l’infermiera ha detto il nome
del suo male che non ha capito lui solo,
finalmente senza giacca
 ",Gilda Policastro
44,Così poi forse divento brava,"Legatemi la testa, non voglio morire
(nessun suicida vorrebbe mai)
Alternativa tra giù e le fiamme
rincorsa e oplà
imparare a stare al mondo
come si passa dalla pianta al vortice
dal cumulo alla sintassi
Verticalizza il dolore nella serie (elenco di farmaci,
a seguire)
ammorbidisci
(rilascia, incapsula, guarisci)
oppure dilacerato, a stacchi (incisioni soprapelle, che si vedano,
che ti facciano, poi, quelle domande,
collaterali, effetti: tutti)
offrilo ai vicini, compassione: condiviso come nei giorni buoni
scomponi i filamenti
(molecole, principi attivi, rifinitura)
La scorciatoia è ribellarti all’escussione
con l’attivismo della tana
ordina in piccole azioni lente precise
il tratto quotidiano dalla testa all’arto, uno:
il cinismo non guarisce nessuno
(dormi con un cane: ti sveglierai?)
Guardatemi, scompaio",Gilda Policastro
45,Cut-up," 
I modi di morire, due li sappiamo,
l’incidente, il cancro, e poi l’infarto secco, l’embolo,
il soffocamento. Quest’ultimo, abbiamo appreso da poco,
vale per i bambini: quelli che non gli praticano in tempo
l’Heimlich, oppure che non hanno l’ess-i-di-esse [1]
ancora prima
In casa muori facile, soprattutto in cucina,
ma pure in bagno, camere e tinello,
le scale per gli anziani, urti per tutti,
folgorazioni  schiacciamenti,
a seguire ustioni (termico-chimiche) e avvelenamenti:
4,5 milioni di infortuni, di cui 8000 con esito letale
e questi sono i morti delle statistiche, dei rapporti annuali
Poi ci sono i modi eccezionali, adesso va il femminicidio:
prendi una donna, cuocila a modo, sgozzala come un maiale,
se lo sai fare (servono corde, un forno a legna, un cavetto del tipo di-vu-di),
un tempo l’infanticidio – Cogne, quella meno famosa Meri,
e altri (l’albanese ne ha macellate un-due-tre in una notte)
Oppure ci sono le botte: prendi due che sempre nella notte, ubriachi,
si abbandonano, dice il superstite, a una guasconata
L’altro muore tra caserma e psichiatria: si è picchiato da solo, ha battuto
la testa, dichiara l’arma (si chiamava Uva Giuseppe,
e dici tu che l’hanno vendemmiato)
Anossia posturale (je so’ saliti sopra) per quell’altro,
Aldrovandi, Riccardo è morto ricorsivo (sto morendo,
sto morendo), autoevidente, metanarrativo",Gilda Policastro
46,Scrolling,"quello che non si capisce, 
che non capiscono 
è il ferro: 
Enel registra il minimo (o il massimo, verificare) 
dei consumi nella fascia mattutina: 
ha stirato, non ha stirato, 
il filo l’ha strangolata con le camicie appese, 
ordinate, 
almeno avrà di che vestirsi, lui là 
è il dark web, si scopre la morte spawnando
giù giù in fondo
tappeti come elastici ti rimandano indietro
a salti (I fucking won) 
azioni sparse in regolare disordine: 
tu io essi sopraggiungono chiamano 
in persone dalla seconda alla terza 
guai la prima, 
l’io puzza ",Gilda Policastro
47,Brevi isole,"Brevi isole
senza considerare il
nello spazio vissuto
la distanza dal suolo
la visione è imperfetta",Nanni Balestrini
48,Innumerevoli ma limitate,"Quante volte me lo
al cavallo che si era avvicinato
al rumore del muro crollato
e afferrò la maniglia scricchiolante
col pacco sotto il braccio e posarlo
dove l’aveva preso e nessuno
(ci sono tante sedie) lì c’era
a ricevere, controllare, a dire.
Che cosa. Mi disse: risolvi.
Dunque un po’ di silenzio, dunque la
colazione: e prenderne per conservare
la razza, il sesso, la statura
a manciate per fare più
in fretta galoppi anche se
appiccica alla pelle, poiché ha fine.
La seconda ragione (fu
sul punto di andarsene, ma vivacemente):
. . . . . . . . . . . .",Nanni Balestrini
49,Frammenti dal Narciso,".
È un po’ come dire che c’è poco da bruciare, oramai,
lo zeppelin è sgonfiato, il fusto è nudo
che fa spavento
io ho avuto tutti i numeri per finir male,
l’amore vizioso, l’ingegno e più l’ambizione pudica
e al momento opportuno un buco nei pantaloni
che ci passano due dita
allora bruceremo pali di ferro
il nostro paese aggiornato, la draga la gru l’idroscalo.
. . . . . . . . . . . . . . .
. . . . . . . . . . . . . . .
Oh, la nostra razza è la più tenace, sia lode al suo fattore,
l’uomo è l’unico animale che sverna ai poli e all’equatore
signore di tutte le latitudini che s’accostuma a tutte le abitudini,
così ho violenta fiducia
non importa come lo dico – ah l’infinita gamma dei toni
che uguaglia solo il numero delle anime sensibili delle puzze della terra
ho violenta fiducia, non importa, che tu mi trovi in mezzo alla furiana
e dopo, quando le rotaie del tram stanno per aria.
. . . . . . . . . . . . . . .",Nanni Balestrini
50,Apologo dell’evaso,"La massima della mia azione difforme,
infausto al popolo il fiume
che al cinema videro spopolare
il delta, i fertilissimi campi
e i più nocivi insetti (chiara
minaccia ai vizi dei governanti!)
Fra i pampini ovunque liberi testi poetici
galleggiavano, gonfi – e si fa vano
l’ufficio dello storicò. Ma saremo
a lungo preservati dal morso
del tafano azzurro, da iniezioni
di calciobromo, dall’unghie della zarina?
Lucenti strani corpi
violano il cielo; sbanda
il filo di formiche diagonale
nel cortile riemerso; ancora
il sole sorge dietro
la Punta Campanella incustodita
dai finanzieri corrotti e un argine
ultimo crolla. Lode
a un’estate di foco. S’io fossi
la piccola borghesia colata
nelle piazze fiorite e nei dì
di festa che salvi c’ignora
dalla droga e dalla noia per un po’
d’uva lavata in mare
presso la marcia catapulta; rifugiati
al primo tuono nelle gelaterie – chi fuggirei?
Passato il temporalaccio d’agosto
i graspi giungono a riva
fra i remi ai contrabbandieri salpati
nel novilunio e anzitutto conviene
(usciti dal vico cieco chiamammo
e orme erano ovunque
dell’abominevole uomo delle nevi)
fare l’amore intanto
che sui porti la Via Lattea dilata.
Il Po nasce dal Monviso;
nuvole… ma di ciò, altra volta.",Nanni Balestrini
51,La poesia fa malissimo,"generazioni di ipocriti di insegnanti di
imbecilli di baciapile di pedagoghi di
pedofili di perecottari di animebelle
puzzolenti
hanno continuamente cercato di in
cularci con una visione edificante
patetica piagnucolosa buonista
di quella cosa
che per sua natura è
un affronto all’esistente
per mezzo della parola
micidiale e inesorabile indecorosa e
sfrontata impudica e
corrosiva la poesia è
l’apocalisse del linguaggio
è un urlo selvaggio che strappa brandelli
di cervello ammuffito fa sanguinare i
corpi anestitizzati dal denaro trafigge i
cuori impotenti cancerizzati
la poesia è un’
interminabile
apocalisse
o non è
la poesia è continua esplosione è
continua rivoluzione è continuo
rifiuto è continua distruzione
della merda accumulata dal
perbenismo criminale dell’homo
economicus globalizzato
la poesia è sputare parole
infuocate avvelenate nei
suoi occhietti melensi
la poesia è la pioggia di sangue di fuoco di
piscio che sommergerà l’infame razza
bastarda del maschio bianco occidentale
con le sue bombe le sue banche i suoi culi griffati
la poesia è anche farla finita con tutti i miserabili
sciacalli che sulle sofferenze che hanno dato una mano
a infliggere intonano inni pietosi agli squartati e ai
fuggiaschi mentre li derubano anche dei pacchi dono
la poesia è una roba che non
ve l’immaginate nemmeno
la poesia è il giubileo delle
energie vitali che dilagano
sul pianeta avvelenato
la poesia
fa
malissimo
cagatevi sotto
la bestia dell’apocalisse è arrivata",Nanni Balestrini
52,La Grande Jeanne,"La Grande Jeanne non faceva distinzioni
tra inglesi e francesi
purchÈ avessero le mani fatte
come diceva lei
abitava il porto, suo fratello
lavorava con me
nel 1943.
Quando mi vide a Losanna
dove passavo in abito estivo
disse che io potevo salvarla
e che il suo mondo era lì, nelle mie mani
e nei miei denti che avevano mangiato lepre in alta montagna.
In fondo
avrebbe voluto la Grande Jeanne
diventare una signora per bene
aveva già un cappello
blu, largo, e con tre giri di tulle.",Luciano Erba
53,Un'equazione di primo grado,"La tua camicetta nuova, Mercedes
di cotone mercerizzato
ha il respiro dei grandi magazzini
dove ci equipaggiavano di bianchi
larghissimi cappelli per il mare
cara provvista di ombra! per attendervi
in stazioni fiorite di petunie
padri biancovestiti! per amarvi
sulle strade ferrate fiori affranti
dolcemente dai merci decollati!
E domani, Mercedes
sfogliare pagine del tempo perduto
tra meringhe e sorbetti al Biffi Scala.",Luciano Erba
54,Le giovani coppie,"Le giovani coppie del dopoguerra
pranzavano in spazi triangolari
in appartamenti vicini alla fiera
i vetri avevano cerchi alle tendine
i mobili erano lineari, con pochi libri
l'invitato che aveva portato del Chianti
bevevamo in bicchieri di vetro verde
era il primo siciliano della mia vita
noi eravamo il suo modello di sviluppo.",Luciano Erba
55,APPARIZIONE,"Alte sopra la tangenziale, chiare,
due case con in mezzo un capannone. E’ questa l’apparizione,
ma non c’è niente da annunciare.
Eppure solo a vederli
là fermi, diritti davanti al sole, i muri ti consolano
più di qualsiasi parola.
Cancellate, ringhiere,
scale, colonne, cornicioni:
ha l’aria, tutto, come se qualcuno dovesse veramente rimanere.
(da Esempi, 1992)
ALLARME
In piena notte
sui viali scatta un allarme. Si ferma, e poi ripete
due note acute, tremende, con la furia di un bambino che gioca.
Nei muri bui dei palazzi lì sopra
le finestre si aprono, si accendono.
Tranne la strada
in mezzo ai rami, vuota,
niente si vede.
Si tirano le tende
e si rimane intorno a questo urlo come si sta in un campo
intorno a un fuoco.",Umberto Fiori
56,PER STRADA,"Se all’angolo una signora
– o magari un vigile –
si volta
con la faccia scavata dalla luce della bella giornata
e parla –proprio a me,
a me, qui – del rispetto che si è perso o del caldo che fa,
io mi sento mancare, come un santo quando lo sfiora l’eternità.
Sento le piante crescere, sento la terra girare. Tutto mi sembra forte e chiaro, tutto deve ancora succedere.",Umberto Fiori
57,DI GUARDIA,"Mi conoscono bene, hanno ragione: io sono come un cane,
una di quelle bestie nere che dormono intorno ai capannoni industriali
e se passi, si avventano di colpo
sulla rete metallica
e più gli dici «Buono!», più si sgolano.
Adesso, chi li consola?
Finché non hai girato l’angolo
gli bolle il sangue. Tirano tutti sordi. Scoprono i denti, mordono
anche il filo spinato; ma sono gli occhi che fanno più paura: sereni
e puri come quelli di un neonato
o di una statua.
Hanno imparato il compito: questo recinto tenerlo sgombro. Sia senso del dovere
o invece solo istinto, non ti commuove almeno per un attimo
la scena che – loro – sempre, tutta la vita, li fa smaniare, li esalta
e li avvelena?
Io, per me, lo capisco
meglio di tutti gli altri che ho mai sentito, questo discorso.
La riconosco bene la voce
fanatica, che sbraita per difendere
– così, alla cieca, per pura gelosia – l’angolo dove l’hanno incatenata.
Tu non sai che cos’è, stare di guardia, in ogni odore
sentire una minaccia
a quei tre metri di terreno,
urlare in faccia al mondo intero fino a perdere il fiato, e non sapere cosa c’è da salvare, a che cosa veramente si tiene.",Umberto Fiori
58,CONTATTI,"Lo vedi come sono
storto, contratto? Lo vedi questo piede, quando mi siedo, come lo metto?
È tutto per lo sforzo, in tanti anni,
di non urtare le persone. Stretto
contro un sedile, dentro l’autobus pieno, stare a posto, evitare
coi miei vicini
persino il minimo contatto.
Sulle panchine delle sale d’aspetto
o in treno, in corridoio, era una pena ogni momento sentire sfiorarsi il buio del mio ginocchio e del loro.
Ore e ore, giornate intere:
uno di fianco all’altro
stavamo, come i gusti del gelato nel bar della stazione.
Di vero tra noi, di giusto, lo spazio di due dita
era rimasto.",Umberto Fiori
59,STRETTOIE,"In tanti vanno, lungo il marciapiede, continuamente. S’incrociano e si scansano, rallentano e poi avanti. Filano, scorrono svelti e tranquilli, finché
di qua c’è un mucchio di assi, di là un rimorchio di camion.
Soltanto uno ci passa. *
Uno soltanto: ma chi?
Ogni volta ti incanti, prima di entrare. Rimani lì a pensarci una vita.
Dall’altra parte la gente arriva spedita, s’infila nella strettoia. Tu le fai ala come una folla al suo sovrano.
*
Con un mezzo sorriso
ti fai da parte, lasci che sfili
un cane
che tira una signora,
poi un tizio che viene
dietro di lei, deciso; ti sporgi appena e subito rientri,
fai largo a un altro con una moto.
Guardali come sono calmi, sereni,
mentre ti passano di fronte
senza parlare, con gli occhi fissi nel vuoto, ognuno un sole che sorge.
Beati, indifferenti:
sembrano dèi.
Tu invece, lì sull’attenti, mastichi amaro.
*
Cos’è, rancore
quello che ti prende
ogni volta? Che torto ti hanno fatto? Passare tu, volevi,
al posto loro?
No, non è questo.
*
Né tu, né gli altri. In quel passaggio stretto vorresti che nessuno avesse cuore
di penetrare;
che durasse per sempre
e per tutti quell’attimo di scrupolo,
di esitazione;
che soltanto a vederlo, questo sentiero sacrificato, in mezzo a due transenne, le persone restassero impietrite
da un infinito rispetto.
*
Allora, fermi a un imbocco e all’altro della strettoia, mille volte ripetere l’invito – prego, si accomodi! –
e mille volte regalarci il mondo
con gli occhi e con le mani, e mille volte rifiutare, e invitarci, finché l’asfalto
che ci separa, a furia di cerimonie
si spacchi, e l’erba lì in mezzo ricresca alta come se mai
ci fosse passato un uomo.",Umberto Fiori
60,ECCOMI,"Dello sbuffo di polvere che si alza
tra le forsizie e le macchine,
di quest’aria di pioggia, di questi morti alla televisione,
richiami di cornacchie, sirene
di ambulanze,
nessuno ci assicura.
Del baretto incendiato, dell’abbraccio di una donna al suo dobermann all’ombra, qui, del portone
– del loro male, del loro bene – abbiamo perso la misura.
Facce, bottiglie rotte, rami fioriti: il mare in cui nuotiamo
precipita
nei nostri occhi senza fondo.
Eppure quando mi chiamano mi volto ancora –vedi?-
e rispondo.",Umberto Fiori
61,Insieme a voi,"Insieme a voi
ho visto il mare brillare, le case correre sempre più grandi
sotto i carrelli del boeing.
«Che caldo fa oggi», ho detto quando era caldo.
Anche per me è stato ottobre, gennaio. So cos’è un letto, una stella, un autobus.
Ho riso, ho avuto sete.
La terza ho fatto, la quarta.
Non basta ancora? Quando mi prenderete?
Potrò essere mai dalla vostra parte?",Umberto Fiori
62,"Le vostre accuse, i vostri","Le vostre accuse, i vostri
rimproveri, di nuovo.
Mentre li smonto come posso, uno a uno,
citando fatti, nomi, date,
mentre riconto sulle dita i miei due, tre, quattro meriti,
e vi abbaio sul muso la mia vita non dite niente: mi guardate.
Le orecchie rosse, le vene
gonfie sul collo
– cosa guardate? Lo so, lo so che il bene è diverso.
Ma non vi fa pietà vedere come
ogni giorno son qua a fargli il verso?",Umberto Fiori
63,LA LUCE SULLE TEMPIE,"Che strano sorriso
vive per esserci e non per avere ragione
in questa piazza
chi confida e chi consola di colpo tacciono è giugno, in pieno sole, l’abbraccio nasce non domani, subito
il pomeriggio, i riflessi
sui tavoli del ristorante non danno spiegazioni vicino alle unghie rosse
coincidono con le frasi
questa è la carezza
che dimentica e dedica
mentre guarda dentro la tazzina le gocce rimaste e pensa al tempo
e alla sua unica parola d’amore: «adesso».",Milo De Angelis
64,NEI POLMONI,"La coperta, la sua forza, mentre crescevamo O gli occhi che ieri furono ciechi,
oggi tuoi, ieri l’inseparabile. Le fiale,
il riso in bianco diventano l’unico
mondo senza simbolo. Materia che
fu soltanto materia, nulla che
fu soltanto materia. Vegliare, non vegliare, poesia, cobalto, padre, nulla, pioppi.",Milo De Angelis
65,TELEGRAMMA,"La finestra è rimasta come prima. Il freddo ripete quell’essenza idiota di roccia
proprio mentre tremano le lettere di ogni parola. Con un mezzo sorriso indichi
una via d’uscita, una scala qualunque.
Nemmeno adesso hai simboli per chi muore.
Ti parlavo del mare, ma il mare è pochi metri quadrati,
un trapano, appena fuori. Era anche, per noi,
l’intuito di una figlia che respira
nei primi attimi di una cosa. Carta per dire
brodo e riso, mesi per dire cuscino. Gli azzurri mi chiamano congelato in una stella fissa.",Milo De Angelis
66,DONATELLA,"La danza fiorisce, cancella il tempo e lo ricostruisce come questo sole invernale sui muri
dell’Arena illumina i gradoni, risveglia insieme agli anni gli dei di pietra arrugginita. «C’è Donata De Giovanni? Si allena ancora qui?»«Come no, la Donatella,
la velocista, la sta semper de per lé.»3
Mi guardava fisso, con l’antica dolcezza milanese che trema lievemente, ma sorride. «Eccola, guardi, nella rete del martello...la prego...parli piano...
con una mano disfa ciò che ha fatto l’altra mano.» “chi è costui? Un custode, un’ombra, un indovino... quali enigmi mi sussurra?” Si avvicinò
a Donata, raccolse una scarpetta a quattro chiodi. «La tenga lei, signore, si graffia le gambe... ...povera Donata...è così bella...lei l’ha vista...»
«Forse il punto luminoso della pista
si è avvitato a un invisibile spavento, forse quest’inverno è entrato nella gola insieme al cielo: era sola, era il ventuno o il ventidue gennaio
e ha deciso di ospitare tutto il gelo»
«O forse, si dice, è successo quando ha perso
il posto all’Oviesse, pare che piangesse
giorno e notte...per non parlare di suo padre... i dottori che ha chiamato...mezza Milano»
«Io, signore, sbaglierò, le potrà sembrare strano ma dico a tutti di baciarla, anche se in questo quartiere è difficile, ci sono le carcasse dell’amore c’è di tutto dietro le portiere. Sì, di baciarla
come un’orazione nel suo corpo, di baciare
le ginocchia, la miracolosa forza delle ginocchia quando sfolgora agli ottanta metri, quasi al filo e così all’improvviso si avvera, come un frutto»
«lo dica già stasera, in cielo, in terra, dappertutto, lo dica alle persone di avvicinarsi: ne sentiranno desiderio – è così bella – e capiranno che la luce non viene dai fari o da una stella, ma dalla corsa puntata al filo, viene da lei, la Donatella».",Milo De Angelis
67,Poesia,"Si dice che la poesia
manchi di vero slancio,
che non sappia più volare
poiché non più sorretta
dai grandi angeli alati.
Che farci? È un mondo
di poeti atei che volano
preferibilmente in aereo.",Valentino Zeichen
68,Il poeta,"Presumibilmente,
sembro un poeta di alta rappresentanza
sebbene la mia insufficienza cardiaca
ha per virtù medica il libro «cuore».
Abito appena sopra il livello del mare
mentre la salute, la ricchezza, la purezza
e gli sport invernali
straziano oltre i mille metri.
Perciò mi ossigeno respirando l’aria
dei paradisi alpini
così arditamente fotografati
dagli scalatori sociali
nonostante la pericolosità dei dislivelli.",Valentino Zeichen
69,Semiotica,"Come la spia rossa che
si accende sul cruscotto
e segnala al conducente,
che la benzina è alla fine,
così, anche il sentimento
che nutrivo per te
è ormai in riserva.",Valentino Zeichen
70,Poetica,"Nel tagliarmi le unghie dei piedi
il pensiero corre per analogia
alla forma della poesia;
questa pratica mi evoca
la fine perizia tecnica
di scorciare i versi cadenti;
limare le punte acuminate,
arrotondare gli angoli sonori
agli aggettivi stridenti.
È bene tenere le unghie corte
lo stesso vale anche per i versi;
la poesia ne guadagna in igiene
e il poeta trova una nuova Calliope
a cui ispirarsi: la musa podologa.",Valentino Zeichen
71,Mi ripeto,"La chiave gira nella toppa
simile a un apriscatole e
scoperchia la latta
È l’amica che apre
e mi sorprende a letto
con un’altra donna
Guarda e sì ritrae
come in presenza
d’un cibo avariato
Piange e richiude
la porta metallica
Mi ripeto...
il mio Cuore è sempre stato
come la porta girevole
d’un albergo a ore
dove si poteva entrare
e pernottare a piacere
ri_uscire in incognito
e senza rimpianti
Ora
vorresti istallare
una porta nel vuoto e
mettere una serratura di marca all’aria?",Valentino Zeichen
72,La fiaba degli amanti,"cui un maleficio tolse
d’incontrarsi
(donna di notte lei
e con la luce falco
lui con la luce uomo
e nottetempo lupo)
ci piacque tanto che per un bel pezzo
ci siamo firmati Knightwolf e Ladyhawke
finché capimmo
l’inutilità della speranza di ritrovarci insieme
nell’umano
il nostro più ambizioso traguardo
essendo di confondere
il pelo con le piume",Michele Mari
73,Non piangere sul latte versato,"verrà di notte il lupo
a leccarlo
perché il lupo è vago
delle cose perse",Michele Mari
74,(Come se un lupo,"fosse mai uscito indenne da una fiaba
come se in ogni falco
non si ripetesse degli Alberighi
l’antico scelo)",Michele Mari
75,Fra il mulino bianco,"e gli anelli di Saturno
la tua scelta era scontata
Ma non immaginerai mai
quanta farina
possono macinare quegli anelli",Michele Mari
